english_word|russian_word|exportedAt|status|knownAt|s1|s2|s3|family
airport|аэропорт|||||The **airport** is 20 minutes from the city.|We arrived at the **airport** early.|The new **airport** is very modern.|flight (n.), airline (n.)
album|альбом|||||She bought a new music **album**.|We looked at the photo **album**.|His **album** is very popular.|
alphabet|алфавит|||||The English **alphabet** has 26 letters.|Children learn the **alphabet** at school.|A is the first letter of the **alphabet**.|alphabetical (adj.)
architect|архитектор|||||The **architect** designed a beautiful house.|She wants to become an **architect**.|The **architect** showed us the plan.|architecture (n.), architectural (adj.)
atmosphere|атмосфера|||||The **atmosphere** in the café was nice.|Earth has a thin **atmosphere**.|The party had a great **atmosphere**.|atmospheric (adj.)
automatic|автоматический|||||The door is **automatic**.|She drives an **automatic** car.|The light turns on **automatically**.|automatically (adv.), automation (n.)
ballet|балет|||||She dances **ballet** since she was five.|We went to see a **ballet** last night.|The **ballet** was beautiful.|ballerina (n.)
banana|банан|||||I eat a **banana** every morning.|She put **bananas** in the salad.|This **banana** is very sweet.|
bank|банк|||||I need to go to the **bank** today.|The **bank** is closed on Sunday.|She works at a big **bank**.|banker (n.), banking (n.)
bar|бар|||||Let's meet at the **bar** after work.|There is a small **bar** near the hotel.|He ordered a drink at the **bar**.|bartender (n.)
baseball|бейсбол|||||**Baseball** is popular in America.|He plays **baseball** at school.|We watched a **baseball** game.|
basketball|баскетбол|||||She plays **basketball** every week.|**Basketball** is a fast sport.|We watched a **basketball** match.|
biology|биология|||||She studies **biology** at university.|**Biology** is my favourite subject.|The **biology** test was easy.|biologist (n.), biological (adj.)
boss|босс|||||My **boss** is very kind.|The **boss** called a meeting today.|She is the **boss** of the company.|bossy (adj.)
brand|бренд|||||This is a popular **brand**.|She only buys this **brand** of coffee.|The **brand** is known worldwide.|branding (n.), branded (adj.)
budget|бюджет|||||We need to plan our **budget**.|The **budget** for the project is small.|She keeps a strict **budget**.|budgeting (n.)
buffet|буфет|||||The hotel has a breakfast **buffet**.|We ate at the **buffet**.|The **buffet** had many dishes.|
bus|автобус|||||I take the **bus** to work every day.|The **bus** was late again.|We waited for the **bus** in the rain.|
business|бизнес|||||He runs a small **business**.|**Business** is going well this year.|She studies **business** at college.|businessman (n.)
café|кафе|||||Let's have lunch at a **café**.|There is a nice **café** on the corner.|She reads books in the **café**.|
calendar|календарь|||||Check the **calendar** for the date.|She marked the day on the **calendar**.|I need a new **calendar** for next year.|
career|карьера|||||She has a successful **career**.|He wants to start a new **career**.|Teaching is a rewarding **career**.|
catalog|каталог|||||Look at the products in the **catalog**.|She ordered from the **catalog**.|The **catalog** has 200 pages.|
category|категория|||||This book is in the fiction **category**.|Choose a **category** from the list.|There are five **categories**.|categorize (v.), categorization (n.)
cement|цемент|||||The wall is made of **cement**.|They used **cement** to fix the road.|The **cement** is still wet.|
center|центр|||||The shop is in the city **center**.|There is a pool in the **center**.|She works at a medical **center**.|central (adj.), centralize (v.)
champion|чемпион|||||He is the world **champion**.|She became a **champion** at 18.|The **champion** won again this year.|championship (n.)
channel|канал|||||What **channel** is the film on?|She watches the news **channel**.|This **channel** shows only sports.|
character|характер|||||He is the main **character** in the film.|She has a strong **character**.|The book has many **characters**.|characteristic (adj., n.), characterize (v.)
check|чек|||||Can I have the **check**, please?|She wrote a **check** for the rent.|He paid by **check**.|
chess|шахматы|||||He plays **chess** every evening.|**Chess** is a game of strategy.|She taught me to play **chess**.|
chocolate|шоколад|||||I love dark **chocolate**.|She bought a box of **chocolate**.|Would you like some **chocolate**?|chocolatey (adj.)
cigarette|сигарета|||||He smokes a **cigarette** after lunch.|**Cigarettes** are bad for health.|She quit smoking **cigarettes**.|
class|класс|||||Our English **class** starts at nine.|There are 20 students in the **class**.|She is the best in the **class**.|classify (v.), classification (n.), classroom (n.)
classic|классический|||||This is a **classic** film.|She reads **classic** literature.|The song is a real **classic**.|classical (adj.), classicism (n.)
climate|климат|||||The **climate** here is warm and dry.|**Climate** change is a big problem.|She prefers a cold **climate**.|climatic (adj.), climatology (n.)
club|клуб|||||He goes to a sports **club** every week.|They opened a new **club** in town.|She joined the book **club**.|
cocktail|коктейль|||||She ordered a fruit **cocktail**.|He makes great **cocktails**.|The **cocktail** party was fun.|
coffee|кофе|||||I drink **coffee** every morning.|Would you like a cup of **coffee**?|This **coffee** is very strong.|
colleague|коллега|||||My **colleague** helped me with the report.|She is a friendly **colleague**.|I had lunch with a **colleague**.|
collection|коллекция|||||He has a large stamp **collection**.|The museum has a great art **collection**.|She showed us her **collection**.|collect (v.), collector (n.), collective (adj.)
comfort|комфорт|||||This chair gives great **comfort**.|She likes **comfort** and warmth.|The hotel offers modern **comfort**.|comfortable (adj.), uncomfortable (adj.), comfortably (adv.)
comment|комментарий|||||He left a nice **comment** online.|She made a **comment** about the food.|Do you have any **comments**?|commentary (n.), commentator (n.)
communication|коммуникация|||||Good **communication** is very important.|**Communication** between teams is key.|She studies **communication**.|communicate (v.), communicative (adj.)
company|компания|||||She works for a big **company**.|The **company** has 500 workers.|He started his own **company**.|companion (n.)
compass|компас|||||Use a **compass** to find north.|The **compass** pointed east.|She always carries a **compass**.|
competition|конкуренция|||||He won the **competition**.|There is strong **competition** in the market.|She entered a singing **competition**.|compete (v.), competitive (adj.), competitor (n.)
computer|компьютер|||||I work on a **computer** all day.|My **computer** is very old.|She bought a new **computer**.|computing (n.), computerize (v.)
concert|концерт|||||We went to a **concert** last night.|The **concert** starts at eight.|She plays the piano at **concerts**.|
conflict|конфликт|||||There is a **conflict** between them.|We need to solve this **conflict**.|The **conflict** lasted many years.|conflicting (adj.)
constitution|конституция|||||The **constitution** protects our rights.|They wrote a new **constitution**.|The **constitution** is very old.|constitutional (adj.)
contact|контакт|||||She is my **contact** at the company.|Keep in **contact** with your friends.|I lost **contact** with him.|contactless (adj.)
content|контент|||||The **content** of the article is good.|She creates online **content**.|Check the **content** of the box.|
contract|контракт|||||He signed a new **contract**.|The **contract** is for two years.|She read the **contract** carefully.|contractor (n.)
corridor|коридор|||||Walk down the **corridor** to the left.|The **corridor** is long and dark.|His office is at the end of the **corridor**.|
credit|кредит|||||She paid by **credit** card.|He has good **credit**.|The bank gave him **credit**.|creditor (n.)
crisis|кризис|||||The country is in a **crisis**.|We need to solve this **crisis**.|The **crisis** affected many people.|
culture|культура|||||I love learning about other **cultures**.|Music is part of our **culture**.|The **culture** here is very different.|cultural (adj.), culturally (adv.)
database|база данных|||||The **database** has all the records.|She built a new **database**.|Check the **database** for his name.|
debate|дебаты|||||There was a long **debate** about the plan.|She won the **debate**.|We had a **debate** in class.|debatable (adj.)
deficit|дефицит|||||The country has a big **deficit**.|The budget **deficit** is growing.|They need to reduce the **deficit**.|
democracy|демократия|||||**Democracy** is important for freedom.|They fight for **democracy**.|The country became a **democracy**.|democratic (adj.), democrat (n.)
design|дизайн|||||She studies **design** at college.|I like the **design** of this phone.|He works in web **design**.|designer (n.)
detail|деталь|||||Please explain in **detail**.|Every **detail** is important.|She noticed a small **detail**.|detailed (adj.)
dialog|диалог|||||The **dialog** in the film is great.|They started a **dialog** about peace.|Read the **dialog** out loud.|
diet|диета|||||She is on a healthy **diet**.|A good **diet** is important.|He changed his **diet** last month.|dietary (adj.), dieter (n.)
diploma|диплом|||||She got her **diploma** last year.|He has a **diploma** in engineering.|The **diploma** is on the wall.|diplomatic (adj.), diplomacy (n.)
disco|дискотека|||||They went to a **disco** on Friday.|The **disco** plays loud music.|She loves to dance at the **disco**.|
discount|дисконт/скидка|||||The shop gives a 20% **discount**.|She asked for a **discount**.|Students get a **discount** here.|
doctor|доктор|||||I need to see a **doctor**.|The **doctor** said I am fine.|She wants to become a **doctor**.|doctoral (adj.)
document|документ|||||Sign this **document**, please.|She lost an important **document**.|The **document** is on the desk.|documentation (n.), documentary (n., adj.)
dollar|доллар|||||It costs ten **dollars**.|She saved a hundred **dollars**.|The **dollar** is strong today.|
drama|драма|||||She studies **drama** at school.|The **drama** was very exciting.|He acts in **drama** films.|dramatic (adj.), dramatically (adv.), dramatize (v.)
economy|экономика|||||The **economy** is growing slowly.|She studies **economy** at university.|A strong **economy** helps everyone.|economic (adj.), economical (adj.), economist (n.)
effect|эффект|||||The medicine had a good **effect**.|What is the **effect** of this change?|The **effect** was immediate.|effective (adj.), effectively (adv.), ineffective (adj.)
element|элемент|||||Water is an important **element**.|There are many **elements** in the table.|Time is a key **element** of success.|elementary (adj.)
emotion|эмоция|||||She hid her **emotions** well.|The film is full of **emotion**.|He showed no **emotion** at all.|emotional (adj.), emotionally (adv.), unemotional (adj.)
energy|энергия|||||I have a lot of **energy** today.|Solar **energy** is clean.|She drinks coffee for **energy**.|energetic (adj.), energize (v.)
engineer|инженер|||||He works as an **engineer**.|She wants to be an **engineer**.|The **engineer** fixed the machine.|engineering (n.)
episode|эпизод|||||I watched the first **episode**.|The new **episode** comes out today.|Each **episode** is 30 minutes.|
evolution|эволюция|||||**Evolution** takes millions of years.|She studies **evolution** in biology.|The **evolution** of technology is fast.|evolve (v.), evolutionary (adj.)
exam|экзамен|||||She passed the **exam** with a high mark.|The **exam** is next Monday.|I need to study for the **exam**.|examine (v.), examiner (n.), examination (n.)
experiment|эксперимент|||||The **experiment** was a success.|She did an **experiment** in the lab.|Let's try a new **experiment**.|experimental (adj.), experimentally (adv.)
export|экспорт|||||They **export** coffee to Europe.|**Export** is important for the economy.|The country's main **export** is oil.|exporter (n.), import (n., v.)
fact|факт|||||That is an interesting **fact**.|In **fact**, she is very smart.|Check the **facts** before you write.|factual (adj.), factually (adv.)
fan|фанат|||||She is a big **fan** of this band.|He is a football **fan**.|The **fans** were very loud.|
fantasy|фантазия|||||She likes **fantasy** books.|That is just a **fantasy**.|The film is a **fantasy** adventure.|fantastic (adj.), fantasize (v.)
festival|фестиваль|||||We went to a music **festival**.|The **festival** lasts three days.|She loves the film **festival**.|festive (adj.)
film|фильм|||||We watched a great **film** yesterday.|This **film** is two hours long.|He makes **films** about nature.|filming (n.), filmmaker (n.)
final|финал|||||This is the **final** game.|She reached the **final** of the contest.|The **final** exam is next week.|finally (adv.), finalist (n.), finalize (v.)
football|футбол|||||He plays **football** every weekend.|**Football** is very popular here.|We watched a **football** match on TV.|footballer (n.)
format|формат|||||What **format** is the file?|She changed the **format** of the report.|The **format** is easy to read.|formatting (n.)
formula|формула|||||This is a simple math **formula**.|She knows the **formula** for success.|The **formula** is very complex.|formulate (v.), formulation (n.)
gallery|галерея|||||We visited an art **gallery**.|The **gallery** has beautiful paintings.|She works at a **gallery**.|
garage|гараж|||||The car is in the **garage**.|He cleaned the **garage** yesterday.|The **garage** is full of boxes.|
generation|поколение|||||The younger **generation** uses technology more.|She is from a different **generation**.|Every **generation** is different.|generate (v.), generator (n.), generational (adj.)
geography|география|||||She studies **geography** at school.|**Geography** is about places and maps.|I love **geography** class.|geographic (adj.), geographer (n.)
golf|гольф|||||He plays **golf** on Sundays.|**Golf** is a quiet sport.|She started learning **golf**.|golfer (n.)
group|группа|||||We work in a small **group**.|The **group** has ten members.|She joined a study **group**.|grouping (n.)
guitar|гитара|||||She plays the **guitar** very well.|He bought a new **guitar**.|I want to learn the **guitar**.|guitarist (n.)
history|история|||||She teaches **history** at school.|**History** is my favourite subject.|The town has a long **history**.|historian (n.), historical (adj.), historically (adv.)
hobby|хобби|||||Reading is my **hobby**.|She has many **hobbies**.|What is your **hobby**?|
hockey|хоккей|||||He plays **hockey** in winter.|**Hockey** is a fast sport.|We watched a **hockey** game.|
horizon|горизонт|||||The sun set on the **horizon**.|She looked at the **horizon**.|A ship appeared on the **horizon**.|horizontal (adj.)
hotel|отель|||||We stayed at a nice **hotel**.|The **hotel** has a big pool.|She booked a **hotel** for two nights.|
humor|юмор|||||He has a great sense of **humor**.|**Humor** helps in difficult times.|The book is full of **humor**.|humorous (adj.), humorously (adv.)
idea|идея|||||That is a great **idea**!|I have no **idea** what to do.|She came up with a new **idea**.|ideal (adj.), idealize (v.)
import|импорт|||||We **import** fruit from Spain.|The **import** of goods is growing.|**Import** taxes are very high.|importer (n.), export (n., v.)
industry|индустрия|||||The car **industry** is very big.|She works in the food **industry**.|**Industry** creates many jobs.|industrial (adj.), industrialize (v.)
information|информация|||||I need more **information**.|The **information** is on the website.|She gave me useful **information**.|inform (v.), informative (adj.), informer (n.)
innovation|инновация|||||**Innovation** drives the economy.|This is an important **innovation**.|She works in **innovation**.|innovate (v.), innovative (adj.), innovator (n.)
instrument|инструмент|||||She plays a musical **instrument**.|The doctor used a special **instrument**.|The **instrument** is very old.|instrumental (adj.)
interest|интерес|||||I have an **interest** in art.|The story is very **interesting**.|She lost **interest** in the topic.|interesting (adj.), interested (adj.), uninteresting (adj.)
internet|интернет|||||The **internet** is very fast here.|I found it on the **internet**.|We have no **internet** at home today.|
interview|интервью|||||She has a job **interview** today.|The **interview** went very well.|He watched an **interview** on TV.|interviewer (n.)
invest|инвестировать|||||She wants to **invest** in a business.|They **invest** money in technology.|It is smart to **invest** early.|investment (n.), investor (n.)
jazz|джаз|||||She loves **jazz** music.|We went to a **jazz** concert.|He listens to **jazz** every evening.|
jeans|джинсы|||||She wears **jeans** every day.|I bought new **jeans** yesterday.|These **jeans** are very comfortable.|
journalist|журналист|||||The **journalist** asked many questions.|She works as a **journalist**.|A **journalist** wrote about the event.|journalism (n.), journalistic (adj.)
kilometer|километр|||||The school is one **kilometer** away.|He runs five **kilometers** a day.|It is 100 **kilometers** to the city.|
lamp|лампа|||||Turn on the **lamp**, please.|There is a **lamp** on the table.|The **lamp** in my room is broken.|
landscape|ландшафт|||||The **landscape** here is beautiful.|She paints **landscapes**.|The **landscape** changed after the storm.|
lecture|лекция|||||The **lecture** starts at ten.|She gave a great **lecture**.|I fell asleep during the **lecture**.|lecturer (n.)
lemon|лимон|||||I like tea with **lemon**.|She squeezed a **lemon** into the water.|This **lemon** is very sour.|lemonade (n.)
liberal|либеральный|||||He has **liberal** views.|The **liberal** party won the vote.|She is very **liberal** in her ideas.|liberalism (n.), liberalize (v.)
limit|лимит|||||There is a speed **limit** here.|She reached her **limit**.|We have a time **limit**.|limitation (n.), limited (adj.), unlimited (adj.)
logo|логотип|||||The company has a new **logo**.|I like the **logo** on the shirt.|She designed the **logo**.|
machine|машина|||||The **machine** is very loud.|She learned to use the **machine**.|The washing **machine** is broken.|machinery (n.), machinist (n.)
manager|менеджер|||||The **manager** of the shop helped me.|She is a good **manager**.|I spoke to the **manager** about the problem.|manage (v.), management (n.)
marathon|марафон|||||He ran a **marathon** last year.|The **marathon** starts at seven.|She is training for a **marathon**.|
marketing|маркетинг|||||She works in **marketing**.|**Marketing** is key for business.|The **marketing** campaign was great.|market (n., v.), marketer (n.)
material|материал|||||The **material** is very soft.|She bought **material** for a dress.|We need more **material** for the project.|materialism (n.), materialistic (adj.)
mechanism|механизм|||||The **mechanism** is very complex.|She explained the **mechanism**.|The clock **mechanism** is broken.|mechanical (adj.), mechanic (n.)
media|медиа|||||The **media** reported the news.|Social **media** is very popular.|She works in the **media** industry.|
medicine|медицина|||||She studies **medicine** at university.|Take your **medicine** twice a day.|**Medicine** has improved a lot.|medical (adj.), medically (adv.), medication (n.)
melody|мелодия|||||The **melody** is very beautiful.|She played a simple **melody**.|I can't forget this **melody**.|melodic (adj.), melodious (adj.)
method|метод|||||This is a new **method** of teaching.|She uses an old **method**.|The **method** is very effective.|methodical (adj.), methodology (n.)
million|миллион|||||The city has two **million** people.|He won a **million** dollars.|**Millions** of people watched the show.|millionaire (n.)
minute|минута|||||Wait a **minute**, please.|The film starts in five **minutes**.|It takes ten **minutes** to walk there.|
modern|современный|||||The building is very **modern**.|She likes **modern** art.|**Modern** life is fast.|modernize (v.), modernization (n.)
moment|момент|||||Wait a **moment**, please.|That was a special **moment**.|At that **moment**, the phone rang.|momentary (adj.), momentarily (adv.)
monitor|монитор|||||She stared at her **monitor** all day.|The **monitor** is too small.|He bought a new **monitor**.|monitoring (n.)
museum|музей|||||We visited a **museum** yesterday.|The **museum** is free on Sundays.|There are old paintings in the **museum**.|
music|музыка|||||I listen to **music** every day.|She studies **music** at school.|What kind of **music** do you like?|musician (n.), musical (adj.), musically (adv.)
nation|нация|||||The whole **nation** celebrated.|She is proud of her **nation**.|Every **nation** has its own culture.|national (adj.), nationality (n.), nationalism (n.)
normal|нормальный|||||This is **normal** for winter.|Everything returned to **normal**.|It is **normal** to make mistakes.|normally (adv.), abnormal (adj.), normalize (v.)
object|объект|||||What is that **object** on the table?|The **object** of the game is to win.|She found a strange **object**.|objective (adj., n.), objection (n.)
office|офис|||||He works in an **office**.|The **office** opens at nine.|She left her bag in the **office**.|officer (n.), official (adj.), officially (adv.)
opera|опера|||||We went to the **opera** last night.|She sings in the **opera**.|The **opera** house is very beautiful.|operatic (adj.)
operation|операция|||||The **operation** was a success.|She had an **operation** on her knee.|The **operation** took three hours.|operate (v.), operator (n.), operational (adj.)
optimist|оптимист|||||She is a real **optimist**.|An **optimist** sees the bright side.|Be an **optimist** — things will get better.|optimistic (adj.), optimism (n.)
orchestra|оркестр|||||The **orchestra** played beautifully.|She plays violin in the **orchestra**.|The **orchestra** has 80 musicians.|orchestral (adj.), orchestrate (v.)
park|парк|||||We walk in the **park** every evening.|The **park** is very beautiful in spring.|Children play in the **park**.|parking (n.)
parliament|парламент|||||The **parliament** passed a new law.|She is a member of **parliament**.|The **parliament** building is very old.|parliamentary (adj.)
partner|партнёр|||||He is my business **partner**.|She danced with her **partner**.|They are **partners** in the project.|partnership (n.)
passport|паспорт|||||Don't forget your **passport**.|My **passport** is valid for ten years.|She lost her **passport** at the airport.|
pause|пауза|||||Let's take a short **pause**.|She made a **pause** before speaking.|**Pause** the video, please.|
period|период|||||This was a difficult **period**.|The **period** of the exam is two hours.|She studied the Victorian **period**.|periodic (adj.), periodically (adv.)
pessimist|пессимист|||||He is a **pessimist** about the future.|Don't be such a **pessimist**.|A **pessimist** always expects the worst.|pessimistic (adj.), pessimism (n.)
philosophy|философия|||||She studies **philosophy** at university.|His **philosophy** of life is simple.|**Philosophy** makes you think deeply.|philosopher (n.), philosophical (adj.)
photo|фото|||||She took a **photo** of the sunset.|Can I see your **photo**?|He posted the **photo** online.|photograph (n.), photographer (n.), photography (n.)
physics|физика|||||He studies **physics** at university.|**Physics** explains how things work.|She is good at **physics**.|physicist (n.), physical (adj.)
piano|пианино|||||She plays the **piano** very well.|He bought a new **piano**.|The **piano** sounds beautiful.|pianist (n.)
pilot|пилот|||||The **pilot** landed the plane safely.|She wants to be a **pilot**.|The **pilot** spoke to the passengers.|
pizza|пицца|||||Let's order a **pizza**.|This **pizza** is very tasty.|She makes great **pizza** at home.|
planet|планета|||||Earth is our **planet**.|Mars is a red **planet**.|There are eight **planets** in our system.|planetary (adj.)
plastic|пластик|||||The bag is made of **plastic**.|We should use less **plastic**.|**Plastic** takes years to break down.|
platform|платформа|||||The train is on **platform** five.|She spoke from the **platform**.|The **platform** was very crowded.|
police|полиция|||||Call the **police** right now!|The **police** arrived in five minutes.|She works for the **police**.|policeman (n.), policewoman (n.)
political|политический|||||It is a **political** question.|She has strong **political** views.|The **political** situation is difficult.|politics (n.), politician (n.), politically (adv.)
